{
  "id": "ai-daily",
  "version": "0.1.0",
  "title": "AI daily briefing",
  "description": "A strict, low-noise briefing from primary AI sources.",
  "quality": "strict",
  "coverage": "balanced",
  "cost": "moderate",
  "sources": [
    {
      "id": "SRC-QWEN-CODE-RELEASES",
      "title": "Qwen Code releases",
      "domain": "developer-tools",
      "cadence": { "minimumHours": 6, "defaultHours": 24, "maximumHours": 168 },
      "connector": {
        "type": "github-releases",
        "config": {
          "repository": "QwenLM/qwen-code"
        }
      }
    },
    {
      "id": "SRC-ARXIV-CS-AI",
      "title": "arXiv Computer Science - Artificial Intelligence",
      "domain": "research",
      "cadence": { "minimumHours": 6, "defaultHours": 24, "maximumHours": 168 },
      "connector": {
        "type": "rss",
        "config": {
          "url": "https://export.arxiv.org/rss/cs.AI"
        }
      }
    },
    {
      "id": "SRC-HUGGINGFACE-TRANSFORMERS",
      "title": "Hugging Face Transformers releases",
      "domain": "foundation-models",
      "cadence": { "minimumHours": 6, "defaultHours": 24, "maximumHours": 168 },
      "connector": { "type": "github-releases", "config": { "repository": "huggingface/transformers" } }
    },
    {
      "id": "SRC-LANGGRAPH-RELEASES",
      "title": "LangGraph releases",
      "domain": "agents",
      "cadence": { "minimumHours": 6, "defaultHours": 24, "maximumHours": 168 },
      "connector": { "type": "github-releases", "config": { "repository": "langchain-ai/langgraph" } }
    },
    {
      "id": "SRC-COMFYUI-RELEASES",
      "title": "ComfyUI releases",
      "domain": "multimodal",
      "cadence": { "minimumHours": 6, "defaultHours": 24, "maximumHours": 168 },
      "connector": { "type": "github-releases", "config": { "repository": "Comfy-Org/ComfyUI" } }
    },
    {
      "id": "SRC-ARXIV-CS-CY",
      "title": "arXiv Computers and Society",
      "domain": "safety-governance",
      "cadence": { "minimumHours": 12, "defaultHours": 24, "maximumHours": 168 },
      "connector": { "type": "rss", "config": { "url": "https://export.arxiv.org/rss/cs.CY" } }
    },
    {
      "id": "SRC-OLLAMA-RELEASES",
      "title": "Ollama releases",
      "domain": "industry-products",
      "cadence": { "minimumHours": 6, "defaultHours": 24, "maximumHours": 168 },
      "connector": { "type": "github-releases", "config": { "repository": "ollama/ollama" } }
    },
    {
      "id": "SRC-PADDLE-RELEASES",
      "title": "PaddlePaddle releases",
      "domain": "china-ecosystem",
      "cadence": { "minimumHours": 12, "defaultHours": 24, "maximumHours": 168 },
      "connector": { "type": "github-releases", "config": { "repository": "PaddlePaddle/Paddle" } }
    }
  ]
}
